{
  "approval_id": "apr-listing-20260731t134204z-6b344b4b",
  "project_id": "clr-2026-large-print-sudoku-for-seniors-easy-puzzles-with",
  "gate": "listing",
  "approver": "PPC",
  "approver_role": "publisher",
  "decision": "APPROVED",
  "artifact_hashes": [
    "sha256:5b0cdfdf87454d1f0fbd5a24f75d2529c33f627709801e8a234f1545b591fec7",
    "sha256:9f4218d3da7dc09583b9e9f076ccb45efbfd1eb16581c7dc288b4e5532be7ae0",
    "sha256:7e8641cd83d8b1d9a2f44a840a52bff3d41a121ac88e3a6827febe6469af8bde"
  ],
  "scope": "Listing metadata and kit reviewed and accepted: title, description, keywords, categories, AI-disclosure, and truthful-claims all verified for paperback puzzle-book, senior-large-print audience, KDP+Etsy channels.",
  "exclusions": [],
  "notes": "",
  "created_at": "2026-07-31T13:42:04Z",
  "expires_at": null,
  "invalidated_at": null,
  "invalidation_reason": null
}
