{
  "approval_id": "apr-compliance-20260814t131122z-a30330b1",
  "project_id": "clr-2026-easy-sudoku-for-adults-relaxing-puzzles-with-ful",
  "gate": "compliance",
  "approver": "PPC",
  "approver_role": "publisher",
  "decision": "APPROVED",
  "artifact_hashes": [
    "sha256:a92bb08cf17777b7ac631e10703f20830265eb03a2041db548361ce6773a3209",
    "sha256:a15543cfd7c3cf555565065fd8ca61b33f3449dcd7919691302157b0ad1c0a39",
    "sha256:b171b1664c1bc69cc9577e8518056a154a160c4aeb1af3791ab4e1151f2f1934"
  ],
  "scope": "reviewed and accepted compliance: AI disclosure, original-only art, cleared Vera fonts, accessibility PASS, rights PASS; territory US, channels kdp and etsy, local packaging and dry-run only, zero paid budget",
  "exclusions": [],
  "notes": "Rights gate PASS, accessibility gate PASS, 0 blocker/major. Legal posture confirmed per production.legal_defaults. This gate authorizes no external action.",
  "created_at": "2026-08-14T13:11:22Z",
  "expires_at": null,
  "invalidated_at": null,
  "invalidation_reason": null
}
