{
  "approval_id": "apr-listing-20260814t131956z-88896921",
  "project_id": "clr-2026-easy-sudoku-for-adults-relaxing-puzzles-with-ful",
  "gate": "listing",
  "approver": "PPC",
  "approver_role": "publisher",
  "decision": "APPROVED",
  "artifact_hashes": [
    "sha256:8957143ff301e6191c77cac87828c452bebd2b97371eb6bfe48cbdeca328b3cf",
    "sha256:43d3e50a97ed3ca94ec11158852e8f4307ae546445f7886b4a2a7680ebc9249c",
    "sha256:0d2798a847a0abffbd921b80bbfe686a5bdd54b13033ebf18b7068223121f8be"
  ],
  "scope": "Listing gate auto-approved per auto_approve_gates=silent policy: metadata validation PASS, zero open blocker/major findings, evidence PASS, no rights or child-safety concern. Binds canonical metadata, its validation report, and the listing-kit. No pricing set and nothing sent to any channel at this stage.",
  "exclusions": [],
  "notes": "Auto-approval recorded with default approver PPC. Human retains override and decides the release gate. 2 open notes are informational layout carry-forwards; neither blocks a gate.",
  "created_at": "2026-08-14T13:19:56Z",
  "expires_at": null,
  "invalidated_at": null,
  "invalidation_reason": null
}
